generell (adjective)	Men hans kvalificerade gissning är att det är en generell uppfattning som vi människor har. 
generös (adjective)	Baksidan av de generösa lånevillkoren visar sig ibland först när det är för sent och alla bindande kontrakt underskrivna. 
tunnelbaneuppgång (noun)	Politikerna planerade nu en tunnelbaneuppgång i Kungsträdgården. 
nationalpark (noun)	Bilden är från Rapaselet i nationalparken Sarek. 
geni (noun)	Här är kroppen ett geni. 
tupp (noun)	Det är också lätt att se framför sig hur tuppen och hönan sover. 
tupplur (noun)	Jo, att en tupplur på trettio minuter kan kompensera tre timmars nattsömn. 
genomblöt (adjective)	Hon som redan är genomblöt skyddas nu från varje droppe, medan han i sina stiliga kläder åter blöts ner. 
genomföra (verb)	Under 1940- och 1950-talen genomfördes en lång rad reformer. 
genomgå (verb)	På 1890-talet, när han bodde i Frankrike, genomgick Strindberg en själslig kris med religiösa inslag. 
genomleva (verb)	På två minuter hade han genomlevat två år av sitt liv. 
natthimmel (noun)	Dessa stjärnor tillhör vårt eget stjärnsystem, Vintergatan en galax, som syns som ett ljust band över natthimlen. 
nattklubbschef (noun)	Jag har redan provat på en hel del i livet ; barpianist, nattklubbschef, filmproducent, massör, författare, konstfotograf och mäklare. 
nattmatch (noun)	Men nattmatcherna i VM i fotboll i USA är nog det bästa minnet så här långt. 
nattportier (noun)	Och det kunde det inte bli utan nattportier, hävdade han. 
nattsvart (adjective)	Banvallen sluttade brant ner, som i nattsvarta avgrunder. 
nattsömn (noun)	Jo, att en tupplur på trettio minuter kan kompensera tre timmars nattsömn. 
nattvak (noun)	Och det bästa är att vi kan ta igen sova igen nattvak och förlorad sömn. 
naturalistisk (adjective)	Den skiljer sig därför från den naturalistiska litteratur som skrevs under 1880-talet och som inleddes med Strindbergs Röda rummet. 
geografilektion (noun)	Bilden visar en geografilektion. 
naturgas (noun)	Exempel på mänsklig inverkan är förbränning av fossila ämnen som olja, kol och naturgas. 
geografisk (adjective)	Den gamla indelningen i landskap har i dag bara kulturell och geografisk betydelse. 
gerilla (noun)	matador, esplanad, platina, gerilla (från spanska) 
gest (noun)	Och han gör en gest mot pannan. 
naturskyddsfråga (noun)	Länsstyrelsen ansvarar bl a för samhällsplaneringen, miljö- och naturskyddsfrågor, civilförsvaret, vissa socialvårdfrågor m m. 
naturvetenskap (noun)	Inom vissa fackområden inte minst inom naturvetenskapen är de engelska orden så många att svenskan stundtals haltar. 
tv-kanal (noun)	Under de senaste åren har antalet tv-kanaler blivit fler och fler. 
naturväsen (noun)	Förr trodde många svenskar på naturväsen. 
naturvårdsverk (noun)	Enligt naturvårdsverket släpper Sverige ut minst växthusgaser per invånare bland OECD-länderna. 
giftermål (noun)	De kunde då konstatera att giftermål var något som vållade unga par mycket vånda. 
giftfri (adjective)	Den är giftfri och kan bara tändas mot ett särskilt plån på askens utsida. 
tv-ruta (noun)	Jan ser fram mot två veckor fulla av aktiviteter på tv-rutan. 
ned (pl)	Man har allt svårare att koppla av och varva ned. 
tvekan (noun)	Ja absolut, säger båda två utan minsta tvekan. 
nedan (adverb)	Här nedan kan du läsa om två populära promenader. 
tvivel (noun)	och tvivlet tiger still 
givmild (adjective)	Den moderne är en kristen invandrare, en arvtagare till det givmilda helgonet Sankt Nikolaus. 
glaciär (noun)	När han exempelvis besteg Elbrus såg han hur glaciärerna förändras. 
glansig (adjective)	gula glada glansiga blad 
nedrustningsfråga (noun)	Palme engagerade sig starkt i freds- och nedrustningsfrågor och blev en internationellt känd politiker. 
glasmålning (noun)	Han stannade, knäade försiktigt på ett ben i taget, och han höjde blicken mot glasmålningarna i butikens tak. 
nedåt (adverb)	Om kraven fortsätter att öka vänder kurvan nedåt igen. 
negerkung (noun)	Jag heter Pippilotta Viktualia Rullgardina Krusmynta Efraimsdotter Långstrump, dotter till kapten Efraim Långstrump, fordom havens skräck, numera negerkung. 
tvättsvamp (noun)	Man köper en fönsterskrapa och putsar fönstren med fönsterputs-medel och vatten på en tvättsvamp. 
global (adjective)	FN:s livsmedelsorgan, FAO, uppskattar att världens boskapsindustri står för 18 procent av de globala utsläppen av växthusgaser. 
neka (verb)	Jaså, du nekar också! 
global uppvärmning (nnm)	Ju mer växthusgaser vi släpper ut desto mer bidrar vi till den globala uppvärmningen. 
neonskylt (noun)	Som det står på neonskylten utanför: Follow that dream. 
tvåbarnsmamma (noun)	Huvudpersonen i boken är journalisten och tvåbarnsmamman Annika Bengtzon, som just blivit chef för kriminalredaktionen på en kvällstidning. 
glufsa i sig (vbm)	De säger emot sina föräldrar, glufsar i sig maten, och tyranniserar sina lärare. 
glädja (verb)	Redan som liten grabb brukade jag glädja min mormor och morfar med egenhändigt lagade middagar då och då. 
glädjas (verb)	Min julklapp till dig är att om du faller ska medmänniskorna glädjas åt att få ta emot dig. 
glädje (noun)	Jag känner en enorm glädje över att den här perioden är över. 
tvång (noun)	När han greps flera år senare hade snatteriet övergått i ett tvång. 
nerv (noun)	Det var visst nerverna som krånglade. 
nervositet (noun)	Redan vid första fikapausen börjar nervositeten släppa och han känner sig välkommen i gänget. 
glåpord (noun)	De får ta emot flest hot, flest svordomar och glåpord av alla. 
glöda (verb)	Du får skriva så att pennan glöder. 
ty (conjunction)	ty rådet var kallat till stämma. 
neråt (adverb)	Damen i biljettkassan: Ja, det är ingen åldersgräns neråt. 
glömska (noun)	Stammande börjar han ursäkta sin glömska. 
neutral (adjective)	Ett neutralt ord är smal. 
tydligen (adverb)	Man måste tydligen vara en supermänniska för att bli anställd. 
gnista (noun)	Elden flammade i det väldiga lokomotivet där de skyfflade in kol, gnistorna yrde vilt ut i natten. 
gnistra (verb)	Hon gnistrar i kapp med de åtta kristallkronorna som pryder taket i caféet. 
tydlighetskommatering (noun)	Det finns olika sätt att komma- tera, men det vanligaste i dag är tydlighetskommatering. 
gnägga (verb)	ropar vaktmästaren och gnäggar mellan skratt och hån. 
nia (verb)	Hans ögon var varma och lite sorgsna och han niade mig blygt. 
gnälla (verb)	Hur många gånger har du hört från andra: Tänk positivt sluta gnälla! 
nicka (verb)	Roeder lyssnar och nickar. 
typsnitt (noun)	Undvik att blanda typsnitt. 
tyrann (noun)	Barnen av i dag är tyranner. 
tyrannisera (verb)	De säger emot sina föräldrar, glufsar i sig maten, och tyranniserar sina lärare. 
nitisk (adjective)	De piskade upp stämningen genom sina anklagelser och fick stöd av uppskrämda föräldrar och nitiska präster. 
nitton (numeral)	Att i nitton år ha levt i vintermörkret utan att någonsin uthärda det. 
tystna (verb)	Pojken tystnade och en snyftning trängde fram. 
nivåskala (noun)	Använd gärna Europarådets nivåskala (CEFR) för att beskriva dina kunskaper i de olika språken (A1-C2). 
godstransport (noun)	Godstransporterna kommer att öka mest. 
tältkåta (noun)	På vintern bodde alla samer i sina tältkåtor i kustlandets skogar. 
tämligen (adverb)	Numera är forskarna tämligen eniga om att klimatet på jorden håller på att förändras. 
tändsticka (noun)	De första tändstickorna tillverkades i början av 1800-talet. 
nomad (noun)	Innanför kusten utbredde sig stora områden där samerna hade levt som nomader och renskötare ända sedan 800-talet. 
tänkande (noun)	Så här ser det nya tänkandet ut: 
tänkbar (adjective)	En tänkbar nedslagskrater har t.o.m. pekats ut: Yucatånhalvön i Mexiko. 
gotländsk (adjective)	Det är t.ex. härligt att lyssna till fina svenska dialekter som gotländska eller dalmål. 
nordamerikansk (adjective)	Till Sverige flyter nu en ström av nordamerikanska lånord som gäller nöjesliv, mat, teknik och mycket annat. 
nordlig (adjective)	De splittrades sedan ännu mera: av germanskan uppstod en östlig, en västlig och en nordlig gren. 
nordpol (noun)	Jordaxeln är en tänkt axel som går från nordpolen, genom jordens medelpunkt till sydpolen. 
tätt intill (abm)	Så kom och håll mej tätt intill dej 
normalbehov (noun)	Normalbehovet av sömn ligger runt 7 timmar (+/1,5 timme). 
tågbiljett (noun)	Agentkontoren ordnade hela resan: båtbiljett över Atlanten och tågbiljett fram till den plats i USA dit man ville komma. 
normalfamilj (noun)	Dessutom skulle en normalfamilj kunna spara 3000 kr per år i bensinkostnader om de ändrade körsätt. 
granngård (noun)	Det är viktigt att vara snäll mot tomten för annars flyttar han till granngården. 
tågresa (noun)	Vad gäller persontrafiken är tågresorna bara sju procent. 
tålamod (noun)	Ett barn som möts med tolerans lär sig tålamod. 
granska (verb)	Med hjälp av listan granskar man först texten som helhet och övergår sedan till detaljkontroll. 
norrländsk (adjective)	Ungefär samtidigt med kräftorna börjar den norrländska surströmmingen säljas. 
tåspets (noun)	De hade smala tåspetsar som stack rakt framåt. 
gratistidning (noun)	På senare år har de stora tidningarna fått konkurrens av gratistidningar, som finansieras helt genom reklam. 
töjbar (adjective)	De var av läder men med kilar av något slags töjbart tyg vid sidorna av skaften. 
gravid (adjective)	Innan han dog, bad han sin gravida fru att bevara de tre delarna av svärdet. 
töras (verb)	Jag törs inte säga hur jag känner för dig, sa hon hastigt och rodnade. 
nos (noun)	Framför igelkottens nos stod bokstaven i. 
novell (noun)	Den här novellen skrevs för hundra år sedan. 
novellförfattare (noun)	Han har som novellförfattare stora likheter med Tjechov och Maupassant. 
grepp (noun)	Hon sitter tyst och lite stel, med fingrarna röda av sanden nu i ett fast grepp om pläden. 
greppa (verb)	Karin greppar efter cigarettpaketet vid brödburken. 
grevinna (noun)	Grevinnan Eva Ekeblad sände in en rapport till akademin om olika sätt att använda potatis. 
ullrock (noun)	Fotografen var klädd i mörkgrå ullrock, lågskor och kostym. 
grillning (noun)	Det börjar redan vid lunchen med öl och snaps och sedan fortsätter det till grillningen med vin. 
grind (noun)	Glöm inte låsa grinden! 
undan (pl)	Erika Man borde kanske starta eget i stället, så man slipper undan alla dessa krav. 
nummerlapp (noun)	Hon hade själv läst på nummerlappen att vi var överhoppade. 
groda (noun)	Ormar och ödlor, grodor och paddor söker sig till ställen där frosten inte kan nå dem. 
undantag (noun)	Med undantag för en mandatsperiod, 1991-1994, hade Sverige socialdemokratiska regeringar 1982-2006. 
nutid (noun)	Även om skriftspråket tidigt blev relativt enhetligt har det ändrats och utvecklats fram till nutid. 
under bordet (abm)	När bibliotekarien tittar åt ett annat håll trycker Leyla upp tugggummit under bordet. 
underförstådd (adverb)	En större och en mindre, underförstått: kista. 
underhåll (noun)	Jag har skilt mig och det blir mycket med underhåll och så där, du vet. 
nybörjare (noun)	Hur gör då nybörjaren som aldrig förut funderat över hur mat produceras? 
underhållning (noun)	Den ger underhållning tillräckligt för många timmar. 
underhållsbidrag (noun)	Mitt underhållsbidrag till dig är att du aldrig någonsin kommer att sluta hoppas. 
nyckelknippa (noun)	Symbolen för hennes makt var nyckelknippan som hon alltid bar med sig. 
nyckelord (noun)	Med utgångspunkt i några nyckelord säger de så här: 
grundord (noun)	Avledning innebär att ett prefix (en förstavelse) eller ett suffix (en ändelse) läggs till ett grundord: 
grundrecept (noun)	Nej, men det är både lätt och roligt om man bara kan några grundrecept ... 
nyfikenhet (noun)	Sådana uppgifter kunde väcka Hans Peters nyfikenhet. 
underlighet (noun)	I dag låter vi sex nysvenskar berätta om underligheter i Sverige. 
nygift (adjective)	De är nygifta och går på Operan om söndagarna. 
underskrift (noun)	Skicka alltid brevet i original med underskrift. 
nyhetsuppläsare (noun)	De flesta nyhetsuppläsare i radio och tv och nästan alla skådespelare talar rikssvenska. 
gruppkänsla (noun)	Samstämmighet och gruppkänsla på jobbet är viktigt och beslut fattas för det mesta i samråd. 
understiga (verb)	Med vintern menas den tid, då dygnets medeltemperatur understiger 0°. 
nykomling (noun)	En annan nykomling är den norska deckardrottningen Anne Holt. 
nykter (adjective)	Han var på en gång nykter affärsman och fantasibegåvad drömmare. 
grupptillhörighet (noun)	Svordomar används för att visa grupptillhörighet. 
grupptryck (noun)	Vi kände grupptrycket och höll hårdare på hedersreglerna än vad våra egna föräldrar gjorde. 
grus (noun)	trög väg på grus, 
nyp (noun)	Förlåt, sa hon och gav sig själv ett kraftigt nyp i örat. 
nypa (noun)	Sedan tillsätter man en burk tomater och salt och peppar och en nypa socker. 
gryt (noun)	Om det blir mildväder, kan den faktiskt lämna grytet och göra ett litet strövtåg. 
gryta (noun)	Viktiga inslag är sill i olika former, kokt skinka och ofta dopp i grytan. 
undfly (verb)	undfly fly bort från 
gräddfil (noun)	Midsommar firas ofta med sill, hackad gräslök, gräddfil och den första färska svenska potatisen. 
undgå (verb)	Ofrivilligt hör vi den ena parten och kan inte undgå att försöka gissa vad den andra parten säger. 
undkomma (verb)	undkomma komma bort från 
gränd (noun)	I stadsdelen Gamla stan lever det gamla Stockholm kvar med sina 1600-talshus och smala gränder. 
gränsa (verb)	En stor del av Sverige gränsar mot hav. 
nyttotrafik (noun)	Mitt förslag är att förbjuda all biltrafik i city som inte direkt kan räknas som nyttotrafik. 
gräslök (noun)	Midsommar firas ofta med sill, hackad gräslök, gräddfil och den första färska svenska potatisen. 
ungdomsledare (noun)	Som ungdomsledare ska du ta hand om ungdomarna och bo tillsammans med dem på vårt campus. 
gräsmatta (noun)	Kalles trädgård bestod av en liten gräsmatta med två små buskar. 
ungdomstid (noun)	Evert Taube hade liksom Ferlin en brokig ungdomstid. 
gräva ned (vbm)	Det brukar bli ett lövbo, kanske nedgrävt i komposten eller i en lövhög. 
gräva ner (vbm)	Ekorren har också grävt ner eller gömt undan ätbara ting både här och där. 
gräva ner sig (vbm)	En del grodor gräver ner sig i bottenslammet i någon sjö. 
näck (noun)	Musiken gör folk förtrollade och de blir ofta förälskade i näcken. 
nännas (verb)	Ingen av oss nändes ens nämna att det på lappen ärligt stått, att de var av boxkalv. 
uniform (noun)	En kvinna som dessutom har uniform och auktoritet. 
gröda (noun)	Beträda fält med växande gröda eller skogsplantering som kan ta skada. 
närbutik (noun)	När det är hans vecka att ansvara för vardagsmaten köper han den på några snabbrundor i närbutikerna. 
universitetsstad (noun)	I universitetsstaden Uppsala sätter studenterna på sig sina vita studentmössor exakt klockan tre. 
närhet (noun)	Vet du om det finns någon pressbyråkiosk här i närheten? 
näring (noun)	Hur ger man kroppen den näring som den behöver? 
näringsgren (noun)	Att framställa järn ur järnmalm var en viktig näringsgren. 
unna (verb)	Både frun och jag har bra löner, så vi unnar oss att leva ett gott liv. 
grötfat (noun)	Han åt till och med upp grötfatet! 
gubbjävel (noun)	Substantiv är ord som du kan sätta fan eller jävel efter, t ex gubbjävel, stoljävel, klockfan. 
närsamhälle (noun)	Närsamhället där du bor tillhör en kommun som har hand om den lokala förvaltningen. 
närvarande (noun)	För närvarande finns det omkring 50 lärosäten i Sverige och skillnaden mellan universitet och högskola minskar. 
närvaro (noun)	Som om han genom sin blotta närvaro ställde till problem för kvinnorna i utlåningsdisken. 
gudstro (noun)	I en undersökning om gudstro i ett 80-tal länder där man ställde frågan Tror du på Gud? 
näsoperation (noun)	Hon har gjort flera ansiktslyftningar, näsoperation, bröstimplantat, fettsugning, förstorade läppar m.m. 
uppehållsrum (noun)	Det är tomt i uppehållsrummet. 
uppenbarligen (adverb)	Att inte kunna ha någon kontakt med omvärlden är ju ett pris du uppenbarligen betalar. 
guldfot (noun)	Zlatan, mannen med guldfoten, har blivit en verkligt stor idrottshjälte. 
uppfattning (noun)	Jag hade skapat mig en uppfattning om att fattiga och rika kunde skiljas åt på fötterna och på skorna. 
nätt (adverb)	Stödd mot min arm du böjer nätt ditt huvud och ditt gyllne hår 
nätt (adjective)	Det är bra nätta saker alltsammans som jag har fått, men jag börjar på att bli litet orolig. 
guldklimp (noun)	Min guldklimp har vunnit nästan allt som man kan vinna. 
guldklocka (noun)	Ur fickan tog Pippi fram en liten fin guldklocka, som hon la på katedern. 
nätverk (noun)	Det gynnar framför allt män eftersom arbetslivets viktiga nätverk ofta består av just män. 
näver (noun)	Ta grenar, kvistar, skott, löv, bark, näver, kåda, ollon och nötter från levande träd och buskar. 
nå (interjection)	Kära far, nå nå, 
guldskatt (noun)	Regin kände till en guldskatt som vaktades av en drake, Fafner (1). 
uppfylla (verb)	Erika Ha, tur att jag uppfyller något krav. 
uppfödning (noun)	Det finns en nivå där efterfrågan och uppfödning överensstämmer för den biologiska mångfaldens bästa. 
någorlunda (adverb)	Är det en någorlunda jämn fördelning mellan substantiv och verb i texten? 
uppge (verb)	Uppge vilken din nivå i respektive språk är samt eventuell utbildning i de olika språken. 
nåldyna (noun)	Av Anna får jag sedan en utmärkt vacker liten broderad nåldyna, som passar till ett fack i syskrinet. 
nån gång (abm)	nån gång för längesen 
nöd (noun)	Det var med nöd och näppe han hann att kränga på sig den ena skon. 
gummibåt (noun)	Flygande gummibåt från Nybroviken (Stockholm) till Afrika, andra annorlunda äventyr är jetski över Atlanten och hundsläde genom Arktis. 
upphov (noun)	Detta kan ge upphov till missförstånd och även till fördomar. 
nödvändigtvis (adverb)	En sak behöver inte nödvändigtvis falla rakt ner, utan faller där den kan göra störst skada. 
nödår (noun)	I slutet av 1800-talet hade Sverige flera svåra nödår med dåliga skördar. 
upphöra (verb)	Under 1970-talet upphörde nästan arbetskraftsinvandringen, eftersom det började bli ont om jobb. 
guttaperka (noun)	Han var i ständig verksamhet och erhöll patent på 85 uppfinningar, däribland konstgjort silke, guttaperka och läder samt gasmotorer. 
nöjesliv (noun)	Till Sverige flyter nu en ström av nordamerikanska lånord som gäller nöjesliv, mat, teknik och mycket annat. 
nöjeslokal (noun)	Fram till 70-talet var alla nöjeslokaler stängda och på radio hördes bara religiös musik. 
upplaga (noun)	Det fullständiga resultatet återkommer vi till i morgondagens upplaga. 
gyllene (adjective)	För två år sedan började jag arbeta som diskplockare på Restaurang Gyllene Fasanen. 
gyllne (adjective)	Stödd mot min arm du böjer nätt ditt huvud och ditt gyllne hår 
nötkreatur (noun)	Men metangasen ökar också genom att vi föder upp så mycket nötkreatur. 
upplysa (verb)	Men hans vänner upplyser honom om att ordet fux inte betecknar hästrasen utan färgen. 
nötkött (noun)	Fast att helt avstå från nötkött är ingen bra idé, tycker de två forskarna. 
gymnasietid (noun)	Under gymnasietiden jobbade hon extra en vinter (vintern 2002/2003) som skidlärare i Hagas slalomklubb. 
uppmana (verb)	Jag skulle vilja uppmana alla andra ungdomar att göra samma sak. 
uppmaning (noun)	Utropstecken kan sättas efter meningar som är utrop eller uppmaningar: 
uppmuntran (noun)	Men ett barn som får uppmuntran lär sig förtroende. 
uppnå (verb)	Detta uppnås genom att ryttaren är tydlig, vägleder, ger stöd och uppmuntrar hästen. 
gynna (verb)	Det gynnar framför allt män eftersom arbetslivets viktiga nätverk ofta består av just män. 
uppochner (adverb)	Men allt det som skedde på festen var bakfram och uppochner. 
obefintlig (adjective)	Vår svenska var i det närmaste obefintlig. 
obegriplig (adjective)	För en människa som inte fördjupat sig i språkhistoria är urnordiskan obegriplig i dag. 
uppriktig (adjective)	Kanske kunde vi ha mötts på ett ärligt och uppriktigt plan som dom främlingar vi är? 
obehaglig (adjective)	Det kändes väldigt obehagligt. 
gärdsgård (noun)	Passera staket, gärdsgårdar, grindar etc, utom till annans tomt. 
uppräkning (noun)	För att markera direkt anföring och före uppräkningar använder vi kolon: 
gärningsman (noun)	Det kan röra sig om en ensam gärningsman, eventuellt någon med ett underligt sinne för humor, säger polisens talesman. 
gäspning (noun)	Men vi vuxna människor måste kväva våra gäspningar och kontrollera vår sömnighet. 
oblekt (adjective)	Se bara på vad som hände med oblekt papper på 1970-talet. 
uppsats (noun)	Ungefär på samma sätt bör man tänka, när man ska skriva en uppsats eller någon annan längre text. 
gå an (vbm)	Men att sova mitt på dagen går inte an. 
gå av stapeln (vbm)	Nästa resa går av stapeln i mars 2007 då Johan ger sig på världens högsta berg Mount Everest. 
gå bort (vbm)	Sedan min hustru gick bort för två år sedan bor jag med mina tre döttrar. 
uppsikt (noun)	Prästen och barnens föräldrar skulle i fortsättningen hålla noga uppsikt över dem. 
gå illa (vbm)	Om man på något sätt skadade trädet kunde det gå mycket illa. 
uppslagsverk (noun)	Vissa större och dyrare böcker, som ordböcker och uppslagsverk, får man inte låna hem utan bara läsa på biblioteket. 
ode (noun)	Oden var den klokaste guden. 
uppsluka (verb)	Den uppslukades av natten. 
gå miste (vbm)	Att få vara med henne varje dag är en förmån som jag aldrig skulle vilja gå miste om. 
gå ned (vbm)	Du går garanterat ned fem kilo på en vecka! 
odlare (noun)	Handlar man från en lokal odlare kan man fråga, säger Johanna Björklund. 
uppställning (noun)	Ditt CV ska vara en lättöverskådlig uppställning av dina erfarenheter och kunskaper. 
odyssé (noun)	Den ursprungliga Odysséen är ett epos som skrevs av den grekiske författaren Homeros ca 700 år f Kr. 
uppståndelse (noun)	Att påsken firas till minne av Jesus död och uppståndelse känner inte alla till i dag. 
gå till beslut (vbm)	Det är dags att gå till beslut. 
odöpt (adjective)	Därför lägger man en bibel eller ett litet kors under kudden på små odöpta barn. 
gå vidare (vbm)	Jonas blir milt sagt upprörd och går vidare till sina kolleger på redaktionen. 
offerplats (noun)	Namn på gudar lever också kvar i många ortnamn, ex Odensala, Torsåker och Frövi (Frejs offerplats). 
uppträde (noun)	Smärtan och fruktan att icke få slut på uppträdet avtvang honom följande lögn: 
upptäcktsresande (noun)	Han var ingen riktig upptäcktsresande. 
gångbar (adjective)	Att kräva varor med minsta möjliga klimatpåverkan är att visa handeln vad som är kommersiellt gångbart. 
uppväga (verb)	(Har du någon svag sida som du kan uppväga med hjälp av en av dina starka sidor?) 
gårdslind (noun)	Det berättas om en man på Öland som högg ner sin gårdslind. 
gårdstomt (noun)	Gårdstomten var alltså väldigt olik vår tids vänligt leende julklappstomte. 
uralisk (adjective)	Uraliska: estniska, finska, ungerska och samiska 
uran (noun)	Marie hade börjat intressera sig för uran och hur det kunde komma sig att det kom ljusstrålar ur uranet. 
urbefolkning (noun)	Norrland var vid denna tid glest befolkat av samer, Norrlands urbefolkning. 
gåva (noun)	Han sysslade med andra, mycket viktigare uppgifter än att springa omkring med gåvor i en säck. 
urdålig (adjective)	Ja, jag är urdålig på att städa. 
oföränderlig (adjective)	Det som ligger still det ändrar sig, medan en människa som hoppar omkring är oföränderlig. 
gödsla (verb)	Djup matjord, fet till den grad att jag inte behöver gödsla den. 
gök (noun)	och ekorren och finken och vårens första gök 
urgammal (adjective)	Detta är en rest från det urgamla julfirandet som fanns före den kristna julen. 
ogillande (noun)	Många människor betraktar ett slentrianmässigt svärande med ogillande. 
gömma undan (vbm)	Ekorren har också grävt ner eller gömt undan ätbara ting både här och där. 
urinvägsinfektion (noun)	Bänken är kall och hon borde resa sig för att inte få urinvägsinfektion. 
urmakare (noun)	Han har varit urmakare, men sedan han förlorat sin verkstad sitter han mest på stadens olika krogar. 
urnordisk (adjective)	Den senare brukar kallas urnordiska och var det gemensamma språket i Danmark, Norge och Sverige. 
ursinnig (adjective)	Men Freja blev ursinnig och sa: 
göra narr (vbm)	Hon var alldeles för självständig och gjorde narr av vuxna människor, och inte gick hon i skolan heller. 
ursprung (noun)	Det kan alltså göra skillnad att ställa frågor i butikerna om transport och ursprung. 
ojämn (adjective)	Vi får inte glömma att konsumtionen är mycket ojämn bland världens länder. 
ursprungstext (noun)	I början av referatet anger man källa, varifrån och när ursprungstexten är hämtad och vem som har skrivit den. 
urspråk (noun)	Man kan säga att det uppstod indiska, romanska, slaviska och germanska dialekter av urspråket. 
göra skillnad (vbm)	Det kan alltså göra skillnad att ställa frågor i butikerna om transport och ursprung. 
usel (adjective)	Den där nya deckaren du rekommenderade mig att läsa var riktigt usel, sa Stina. 
olivolja (noun)	Hon brukade svara att hon alltid använde olivolja i matlagningen och att hon älskade portvin. 
