knäa (verb)	Han stannade, knäade försiktigt på ett ben i taget, och han höjde blicken mot glasmålningarna i butikens tak. 
knäcka (verb)	För mycket lärdom kan knäcka den friskaste. 
bröllopsfest (noun)	Gör klart för bröllopsfest! 
bröstficka (noun)	Men han tog solpapperet, kysste det och lade det i sin bröstficka. 
knäpp (adjective)	Knäpp, knäpp, knäpp, det kommer att ta dig tre år att komma ikapp. 
bröstimplantat (noun)	Hon har gjort flera ansiktslyftningar, näsoperation, bröstimplantat, fettsugning, förstorade läppar m.m. 
knölig (adjective)	Hans platta och knöliga fot i den grå ullstrumpanbröt starkt av mot de smala fötterna omkring. 
smart (adjective)	Dessutom påstår forskarna att tuppluren gör att man blir smartare och piggare på eftermiddagen. 
budskap (noun)	Är texten entydig m.a.o. lätt att ta till sig eller måste man tolka textens budskap? 
smaskig (adjective)	Samtidigt som man i samma tidning får recept på den smaskigaste chokladtårtan. 
buga sig (vbm)	Ju längre frampå dagen, dess vackrare folk, sa gubben och bugade sig. 
smed (noun)	Kedjan krånglade men hon fick en smed att fixa den. 
smeka (verb)	Han smekte hennes kind. 
buljong (noun)	Detta dopp går till så att man doppar skivor av ett sött bröd i grytan med buljongen från skinkan. 
buljongtärning (noun)	6 stora potatisar 1 purjolök en buljongtärning salt och peppar 
smida (verb)	Bäst att smida medan järnet är varmt, sa gubben. 
buller (noun)	Det ser inte ut som * andra fotoalbum, utan alla foton är huller om buller. 
bullra (verb)	Tomma tunnor bullrar mest, sa gubben. 
smidig (adjective)	Han har ett rytmiskt och smidigt språk och därför har många av hans dikter tonsatts. 
bullrig (adjective)	Det största problemet är att det är rätt så bullrigt i lokalen så jag måste ha hörselskydd hela dagarna. 
smita (verb)	Under långloppen hinner Jan också smita ut i köket och laga till lite snabbmat. 
smitta (noun)	När han upptäckte olika smittosamma sjukdomar, som t.ex. tuberkulos, kunde han också beskriva hur smittan sprids. 
burmansk (adjective)	Sino-tibetanska: kinesiska, tibetanska, burmanska 
smittosam (adjective)	När han upptäckte olika smittosamma sjukdomar, som t.ex. tuberkulos, kunde han också beskriva hur smittan sprids. 
koldioxid (noun)	Tyvärr finns det ingen teknik som kan hindra att koldioxiden kommer ut från motorerna. 
koldioxidutsläpp (noun)	Sektorn bilism och transporter står f n för över 30 % av Sveriges koldioxidutsläpp. 
busschaufför (noun)	Det i kombination med det omättliga begäret att hjälpa människor fick honom att bli busschaufför här i Sverige. 
busstid (noun)	Per åker bil till arbetet, eftersom busstiderna inte passar hans arbetstider. 
kolhydrat (noun)	c En banan jag får kolhydrater som gör att jag orkar mer. 
butelj (noun)	och ratar icke buteljen, 
butiksägare (noun)	Man kan påpeka saker i affärerna och få butiksägare att ändra sortimentet. 
smusslande (noun)	Kärleken växte, men Farman kände allt starkare att smusslandet var ovärdigt och absurt. 
bygd (noun)	Caféet lär ha potential att bli mer än ett fik för bygdens människor. 
kollektiv (noun)	Den stora gruppen, kollektivet, missunnade en enskild person att lyckas bättre än de andra. 
smutsa ned (vbm)	Slutligen drabbas Östersjön relativt ofta av större eller mindre oljeutsläpp, vilket bl.a. medför sjöfågeldöd och nedsmutsade stränder. 
kollektiv (adjective)	Han har aldrig känt sig hemma i någon kollektiv enhetlighet. 
bygga om (vbm)	Beslutades att lagerlokalen på Tallvägen 4 ska byggas om till motionsrum och bastu. 
bygga ut (vbm)	Om resenärer tänkte om och järnvägsspåren byggdes ut skulle vi ha ett mycket klimatsmartare samhälle. 
smäll (noun)	En del tror att det då kommer en ny stor smäll. 
kolon (noun)	För att markera direkt anföring och före uppräkningar använder vi kolon: 
byggvara (noun)	Istället för Jonas artikel blir det tre sidor med annonser om byggvaror och trädgårdsväxter. 
smärt (adjective)	Glad rökfri tjej 62 år 173 lång smärt, söker kille ca 58 år och uppåt. 
smärtfrihet (noun)	Smärtfrihetens värld han någon minut levt i hade rämnat för honom. 
byte (noun)	Där byte » Au till b uSS 8H (o Som går 10.58. 
komma bort (vbm)	undkomma komma bort från 
bytesrätt (noun)	En del affärer som inte erbjuder öppet köp kan i stället ge dig bytesrätt. 
bäck (noun)	Nu kom vi till bron över bäcken. 
småbonde (noun)	De första som utvandrade var småbönder med sina familjer. 
komma ifrån (vbm)	Här verkar man ge kritik i omvänd ordning jämfört med där jag kommer ifrån. 
småbutik (noun)	Han tog exempelvis aldrig från småbutiker eftersom det kändes oschyst. 
bädda in (vbm)	Till sist kommer den att ligga som en osynlig ton, inbäddad i den evigt susande vinden från havet. 
bägare (noun)	Men detta blev droppen som fick bägaren att rinna över. 
bägge (prounoun)	Har då bägge längtat efter barn så chansar man. 
småflicka (noun)	Vid påsk brukar många småflickor i vårt land klä ut sig till påskkäringar. 
komma på tal (vbm)	Vid jul kom frågan om min fars resårkängor på tal. 
bära sig åt (vbm)	Inte vet jag hur man bär sig åt här? 
komma undan (vbm)	Alla i gänget hade tjugo ögon och tjugo öron ; ingens syster kunde komma undan. 
bästis (noun)	Malin Min bästis Frida var den som först fattade hur dålig jag var, till och med före mig själv. 
komma upp (vbm)	Man måste kunna se sig själv på toppen, annars kommer man aldrig upp. 
bättra (verb)	Under den perioden bättrade jag också på min skolfranska. 
småord (noun)	Det är ofta yngre personer som använder de här småorden. 
bättre stämma i bäcken än i ån (inm)	Bättre stämma i bäcken än i ån, sa gubben. 
bättring (noun)	Hon fick då göra något hemlighetsfullt läkemedel som kunde ge bättring. 
bål (noun)	höra huru gumman i bålet satts, att brinna. 
båtbiljett (noun)	Agentkontoren ordnade hela resan: båtbiljett över Atlanten och tågbiljett fram till den plats i USA dit man ville komma. 
båtklubb (noun)	Var båtklubb hyr en lyftkran, för då går det mycket lättare. 
kommissionskontor (noun)	Kommissionskontoret: jungfrun har flyttat, eller skall en ny anställas. 
småsten (noun)	Med ett klingande skratt red Pippi ut genom porten, så att småstenen yrde om hästhovarna och skolans fönsterrutor skallrade. 
böjning (noun)	SAOL anger stavning, uttal och böjning av ord och fungerar som språklig lagbok. 
småsyskon (noun)	f _ Småsyskon har ofta mindre förväntningar på sig än storasyskon. 
smått (adjective)	Birgitta: I tonåren, fast då var det mest smink, godis och annat smått. 
kommunalråd (noun)	Kommunalrådet lovar att inte glömma vad han har sagt. 
småungar (noun)	Några småungar åker pulka på frosten i en slänt. 
börda (noun)	Från denna tid måste Alfred ta på sig hela bördan av familjens försörjning. 
kommundel (noun)	En kommundel styrs av en kommundelsnämnd som är tillsatt av kommunfullmäktige. 
bördig (adjective)	Kustlandet i övre Norrland var bördigt, och där bodde svenskar som flyttat dit söderifrån. 
smörbakelse (noun)	Vi har redan ätit både lutfisk, risgrynsgröt och smörbakelser. 
börja om (vbm)	Min historia är slut och den börjar ständigt om igen. 
kommunfullmäktig (noun)	Kommunens beslutande organ är kommunfullmäktige, som väljs av kommunens medlemmar i politiska val, alltså en motsvarighet till riksdagen. 
böta (verb)	Han var tvungen att böta. 
kommunikationsspråk (noun)	Bantuspråk: swahili, ett viktigt övernationellt kommunikationsspråk i Östafrika 
smörsida (noun)	En smörgås faller alltid med smörsidan neråt. 
kommunstyrelse (noun)	Kommunens regering kallas kommunstyrelsen. 
campus (noun)	Som ungdomsledare ska du ta hand om ungdomarna och bo tillsammans med dem på vårt campus. 
snabbhet (noun)	Han har en ovanlig snabbhet på plan, han är 1,92 m lång och han är en synnerligen duktig tekniker. 
kompakt (adjective)	Försäljaren: Ja, men AEG-maskinen centrifugerar bättre, och så är den mer kompakt. 
kompanjon (noun)	Hans försök att skapa en internationell trust motarbetades av hans kompanjoner, av vilka flera var mindre hederliga. 
snabbrunda (noun)	När det är hans vecka att ansvara för vardagsmaten köper han den på några snabbrundor i närbutikerna. 
kompensera (verb)	Jo, att en tupplur på trettio minuter kan kompensera tre timmars nattsömn. 
cell (noun)	Kanske hade lektor Hedman suttit i sin cell på Långholmen och läst i just den här boken? 
celltillväxt (noun)	Vitamin D verkar vara mycket effektiv i att reglera celltillväxt och därmed förhindra bland annat tumörbildning. 
snack (noun)	Det finns jobb som innebär mer snack med kunder än andra. 
snapsvisa (noun)	Den mest traditionella snapsvisan är den här: 
komplettera (verb)	Då måste jag komplettera mina betyg eller se till att få bra poäng på högskoleprovet. 
centrifugera (verb)	Försäljaren: Ja, men AEG-maskinen centrifugerar bättre, och så är den mer kompakt. 
komponera (verb)	Min flickvän brukar komponera en speciell festivalmiddag för den stora dagen. 
snattande (noun)	Birgitta: Jag har försökt några gånger utan att lyckas, men nu får det vara nog med snattandet. 
chansa (verb)	Jo, är det inte oftast då vi är stressade som vi chansar och lämnar bilen på en otillåten parkeringsplats? 
sned (adjective)	Dom lägger sina huvuden på sned, skrattar och håller varandra i händerna. 
kompromiss (noun)	En svensk försöker undvika konflikter och bråk och vill så snabbt som möjligt komma fram till en kompromiss. 
snedstreck (noun)	När vi vill visa att man kan välja mellan två likvärdiga alternativ kan vi använda snedstreck: 
kompromissa (verb)	Man kompromissar helt enkelt lite för att göra sig förstådd på bägge sidor Atlanten. 
snigelfart (noun)	Visserligen har andelen ökat de senaste tio åren, men ökningen går med snigelfart, från 27 procent till 31,5 procent. 
snitt (noun)	Med i snitt 233 vänner toppar malaysierna listan på de mest sociala facebookanvändarna i världen. 
chefsjobb (noun)	Siffrorna för andelen arbetsverksamma kvinnor med chefsjobb är ännu dystrare. 
konceptpapper (noun)	Han tog ner arket ; det var sådant där solgult konceptpapper som det lyser av. 
chefsposition (noun)	Högst andel kvinnor i chefsposition har Lettland och Litauen, med 42 respektive 38 procent. 
chefsrekrytering (noun)	I många fall sker chefsrekryteringen genom att man handplockar en person eller att man uppmanar någon att söka tjänsten. 
chevreau (noun)	Det ska väl inte vara mocca utan chevreau räcker väl? 
chili (noun)	Jag är galen i chili! 
snok (noun)	Man kan finna huggormar och snokar som tillbringar vintern tillsammans. 
chockera (verb)	De vill chockera folk, till exempel genom att klä sig extremt. 
snurra (verb)	Samtidigt som jorden rör sig i sin bana runt solen så snurrar den kring sin egen axel, jordaxeln. 
konflikt (noun)	Du orkar inte riktigt ta tag i en konflikt som dyker upp. 
snyfta (verb)	Johan, som aldrig rört vinbuteljen, faller i gråt och snyftar: 
cigarettpaket (noun)	Karin greppar efter cigarettpaketet vid brödburken. 
snyftning (noun)	Hon svalde en snyftning. 
snäckskal (noun)	När stranden fylls av snäckskal 
konjunktion (noun)	Utelämna konjunktioner: Jag är mycket trött så jag kommer inte på festen. 
das cirrusmoln. 
konkret (adjective)	Försök att visa dina starka sidor med konkreta exempel i stället. 
citattecken (noun)	Anföringstecken eller citattecken ) används 
citera (verb)	Ungefär så lyder ett kurdiskt ordspråk som Farman Sediqs släktingar ofta citerade under hans uppväxt. 
city (noun)	Mitt förslag är att förbjuda all biltrafik i city som inte direkt kan räknas som nyttotrafik. 
civilförsvar (noun)	Länsstyrelsen ansvarar bl a för samhällsplaneringen, miljö- och naturskyddsfrågor, civilförsvaret, vissa socialvårdfrågor m m. 
konserthus (noun)	Jonas ringer till Konserthuset för att beställa biljetter till popkonserten nästa helg. 
comeback (noun)	Samma färger som vid Elvis comeback 1968. 
snöre (noun)	Den tyckte han var rolig, eftersom den blev en bra slungsten på ett snöre. 
konservburk (noun)	8-10 ansjovisar (ur konservburk) 
snörkänga (noun)	Lotta sätter sig på en bänk och tittar på sina snörkängor, de med den kraftiga praktiska sulan. 
snörum (noun)	Du kan välja mellan att bo i snörum eller isrum (isrummen är dyrast). 
konsistens (noun)	De ständiga sprängningsolyckorna sammanhängde med nitroglycerinets flytande konsistens. 
konstant (adjective)	Under det följande halvåret var den 18-åriga systern satt under konstant bevakning. 
cykelställ (noun)	Han går ut, tar sin cykel i cykelstället och beger sig till Stadshallen för att bevaka gymnasieskolans musikaliska föreställning. 
cykelväg (noun)	Ibland slutar en cykelväg plötsligt vid en korsning eller väg och fortsätter sedan en bit bort på andra sidan. 
cykling (noun)	Som ung kunde hon ägna sig åt pianospel, cykling, simning och tennis. 
konstfotograf (noun)	Jag har redan provat på en hel del i livet ; barpianist, nattklubbschef, filmproducent, massör, författare, konstfotograf och mäklare. 
socialreformatorisk (adjective)	I hans arkiv finns utkast till både socialreformatoriska romaner och känsliga poesiförsök. 
dagblad (noun)	Dagbladet har ställt några frågor till Henning Mankell. 
socialvård (noun)	Det gäller framför allt skolor, äldrevård, socialvård och socialt bistånd samt miljö- och hälsoskyddsarbete. 
sociolog (noun)	I dag är det både läkare, sociologer och psykologer som forskar på det här området. 
konstruktion (noun)	Börjar många meningar på samma sätt, t.ex. med subjektet eller konstruktionerna Sedan ... 
dagordning (noun)	Eva: Kan vi också fastställa dagordningen enligt förslaget? 
dal (noun)	Och göken ropar uti hans gröna dal 
damfotboll (noun)	Göran: Damfotbollen kommer starkt, fast det är fortfarande övervägande killar som spelar. 
damm (noun)	Resårerna var grå och inpyrda av årens damm. 
dammig (adjective)	Det är ju alldeles dammigt över allt. 
konsumtion (noun)	Vi får inte glömma att konsumtionen är mycket ojämn bland världens länder. 
dammsugare (noun)	Dammsugaren var den första hushållsmaskinen med elmotor. 
dammsugning (noun)	Efter det är det dags för dammsugning. 
dans på rosor (nnm)	Puja Abar spelar mittsexa i Sollentuna HK:s juniorlag och det tycks inte vara någon dans på rosor. 
kontaktyta (noun)	Dels ger pauserna möjlighet att rensa hjärnan, dels fungerar de som en kontaktyta på företaget. 
soffhörn (noun)	Jag kurar ihop mig i soffhörnet som en katt och kunde jag spinna skulle jag göra det. 
kontinental (adjective)	Hon gav sin tomte drag både av den kontinentale Nikolaus och i någon mån den gamle nordiske tomten. 
darr (noun)	Hon stod tyst en stund och sen sa hon med darr på rösten: 
darra (verb)	Om du inte kan persiska, säger Battenbach och den oerhörda tanken får hans röst att darra. 
solcell (noun)	Jag har satellittelefon och e-mailcentral uppbyggd med solceller för att kunna lägga in mina rapporter på min sajt, 
datasystem (noun)	Datasystemet hade gått sönder och de hade ingen pop corn-personal som kunde hoppa in till kvällen. 
kontrast (noun)	Den fysiska ansträngningen är en bra kontrast till studierna i Viktor Rydbergs gymnasium på Norrtullsgatan. 
datormus (noun)	Han uppfann datormusen för att kunna lägga in diagram på datorn. 
konung (noun)	Karl XI (konung Karl) regerade 1660-1697. 
datorstopp (noun)	7 _ _ _ _ påverkades minst av alla av datorstopp. 
datorvärld (noun)	I dag har många engelska lånord med datorvärlden att göra, som datasupport, scanner, printer, mejla (svensk stavning). 
debattera (verb)	Där kunde de nya liberala idéerna inom politiken debatteras. 
debattinlägg (noun)	Kultursidan har artiklar om litteratur, konst, musik, teater och film, men också debattinlägg i samhällsfrågor. 
solsystem (noun)	Längst ut i solsystemet kretsar den lilla märkliga Pluto, minst känd av planeterna. 
deckardrottning (noun)	En annan nykomling är den norska deckardrottningen Anne Holt. 
kopieringspapper (noun)	Varför är det ingen som fyller på kopieringspapper till exempel? 
soltorka (verb)	Lertavlorna soltorkades sedan, och man hade en bok. 
defensiv (adjective)	Men en defensiv pessimist ger inte upp på grund av de negativa tankarna. 
definiera (verb)	I Nationalencyklopedins ordbok definieras ordet genre som typ av framställning som kännetecknas av viss uppsättning stildrag eller innehållsliga faktorer. 
solventil (noun)	Dalén uppfann också solventilen, som tänder fyren på kvällen och släcker den på morgonen. 
som en dans (abm)	Allt tycks gå som en dans. 
koptisk (adjective)	Semitisk-hamitiska: arabiska, hebreiska, assyriska, koptiska ; hau- sa, ett viktigt övernationellt kommunikationsspråk i Västafrika 
dela med sig (vbm)	Ofta dröjer man kvar, diskuterar olika projekt och delar med sig av sina kunskaper och erfarenheter. 
som en fisk (abm)	Tränaren ser själv ut som en fisk, med munnen öppen utan ljud. 
som en lärka (abm)	Lycklig som en lärka uti majsolens sken, 
som en uggla (abm)	Att vara klok som en uggla betyder att vara mycket klok. 
flesta är delaktiga i besluten. 
delegera (verb)	Där lärde han sig hur viktigt det är att vara lyhörd, att delegera arbetet och fördela ansvaret. 
som hand i handske (abm)	En arbetsplats som passar mig som hand i handske. 
dement (adjective)	En äldre människa som inte minns så bra kanske inte alls är dement. 
korn (noun)	Anders: Anders Mattson på Skrot och Korn. 
som regel (abm)	Svensken är som regel mer rakt på sak. 
kors (noun)	Lägg inte heller armarna i kors över bröstet. 
den ena efter den andra (pnm)	Men snart ger den ena efter den andra till ett glatt utrop. 
sommardräkt (noun)	Skillnaden i färg mellan vinter- och sommardräkt är stor längst i norr och liten i södra Sverige. 
depression (noun)	Du kanske har fått en årstidsbunden depression. 
desarmera (verb)	Vi tar det misstänkta föremålet till ett säkert ställe som är avspärrat och låter vår robot desarmera det. 
kort varsel (nnm)	Chefen: Vad fint att alla kunde komma med så kort varsel. 
kortfilm (noun)	En film som är kortare än 1 timme brukar kallas kortfilm. 
kortregister (noun)	Om biblioteket inte har sin katalog på dator så finns den alltid som kortregister på papper. 
kortsida (noun)	Hon sitter vid kortsidan i sitt bibliotek. 
sommarsol (noun)	För dig som har ljus hy räcker det med 10-15 minuters sommarsol på ansikte och armar varje dag. 
desto (adverb)	Ju högre växel du lägger i desto mindre bränsle drar bilen. 
kortverb (noun)	ende (av kortverb, verb som slutar på lång vokal ; betecknar oftast handling) (ett) gående, (ett) boende, ett leende 
sommarsolstånd (noun)	Men från början firades den vid sommarsolståndet, den 21 juni, årets kortaste natt. 
kortända (noun)	Pappa vid den ena kortändan och mamma vid den andra. 
sommarställe (noun)	Jag serverade och passade upp på dem när de hade gäster ute på vårt sommarställe. 
sommarsäsong (noun)	Restaurang Lyxlaxen söker serveringspersonal inför sommarsäsongen. 
sommarvind (noun)	Lekfullt och lätt du svävar än som fjäril väckt av sommarvind 
diabetes (noun)	Exempel på moderna latinska och grekiska lånord är telefon, elektricitet, diabetes, hygien. 
diagnos (noun)	Han var den förste som kunde ställa diagnos om t.ex. hjärnhinneinflammation och ansiktsförlamning. 
diagram (noun)	Han uppfann datormusen för att kunna lägga in diagram på datorn. 
dialektal (adjective)	Många ord är dialektala de används bara i vissa delar av landet. 
diesel (noun)	För närvarande använder vi 96 procent fossila bränslen (bensin och diesel). 
dietförslag (noun)	Till sist fick han ett dietförslag som verkligen hjälpte och han lyckades gå ner 21 kg på ett år. 
kostvana (noun)	Kostvanorna har också förändrats genom information från vetenskapligt håll. 
kotte (noun)	), nedfallna kottar samt kvistar och ris som lämnats kvar. 
sopran (noun)	konsert, kasino, sopran, bank (från italienska) 
diktverk (noun)	Han läste mycket helst romaner med ideell tendens och dryftade diktverken i affärsbreven. 
kramgo (adjective)	Söker likasinnad kramgo tjej 25- 40 för varaktigt förhållande. 
sorglig (adjective)	Det är ett både vackert och lite sorgligt porträtt av en älskad far. 
sorgsen (adjective)	Hans ögon var varma och lite sorgsna och han niade mig blygt. 
krans (noun)	Då binder jag en krans av löv 
sork (noun)	Möss och sorkar har samlat förråd under hela hösten. 
diplomati (noun)	Hammarskjölds arbete som FN:s generalsekreterare präglades av förebyggande och tyst diplomati. 
sortiment (noun)	Man kan påpeka saker i affärerna och få butiksägare att ändra sortimentet. 
krav (noun)	Erika Man borde kanske starta eget i stället, så man slipper undan alla dessa krav. 
sova ut (vbm)	När får vi rätt att sova ut? 
sovmorgon (noun)	Mitt förslag är att tonåringarna ska få sovmorgon varje dag. 
diskplockare (noun)	För två år sedan började jag arbeta som diskplockare på Restaurang Gyllene Fasanen. 
sovstol (noun)	Exempelvis har en kommun i Danmark installerat sovstolar och lagt in 20 minuters vilopaus efter lunch. 
diskrimineringsutredning (noun)	Boken har givits ut av en statlig utredning som kallades Diskrimineringsutredningen. 
kretsa (verb)	Månen kretsar snabbt runt vår jord. 
kretskort (noun)	När han utvecklade färggrafiken ville han kunna göra ritningar av kretskort i datorn. 
disponera (verb)	Så här kan du disponera ditt personliga brev. 
disposition (noun)	Man börjar med att göra en plan, en disposition. 
krigarkung (noun)	Krigarkungen Karl XII (1682-1718) deltog under sin regeringstid (1697-1718) i flera krig i Europa. 
ditt och datt (pnm)	Man slår sig ner tillsammans en stund för att koppla av och prata om ditt och datt. 
dittills (adverb)	Panthea hade bara sagt tack och tack så mycket dittills. 
krigsredskap (noun)	Han uppfann sprängämnen och krigsredskap men var själv en fridens man som avskydde våld. 
diverse (adjective)	Sitt tråkiga Ikea-möblerade radhus med Billy-bokhyllor, Klippan-soffor och diverse trasmattor fann hon inte intressant nog att bjuda Panthea till. 
djup (noun)	Det dånade därnere i djupet, hemskt som om den ville sluka oss, avgrunden öppnade sig under oss. 
djupsinnighet (noun)	Tyvärr blev självbiografin aldrig färdig, men denna herre av mycken liten djupsinnighet är ändå välbekant för oss. 
djupsömn (noun)	4Inne i djupsömnen är man som mest svårväckt. 
sparka upp (vbm)	Hon sparkade upp hissdörren och gick ut i garaget. 
djurläkare (noun)	Det var ont om läkare och veterinärer (djurläkare). 
sparkapital (noun)	Biljetterna var billiga, men ett litet sparkapital måste man ha. 
sparlåga (noun)	Igelkotten går verkligen på sparlåga. 
djärv (adjective)	Arvid Horn hade under Karl XII:s tid varit en djärv och tapper krigare. 
djävel (noun)	När orden djävul och djävlar används som svordomar kan de också stavas jävel och jävlar. 
doft (noun)	Också en annan doft spred sig då foten blivit fri. 
kristallkrona (noun)	Hon gnistrar i kapp med de åtta kristallkronorna som pryder taket i caféet. 
doktorsavhandling (noun)	Marie bestämde sig för att hennes doktorsavhandling skulle handla om uranets förmåga att ge energi. 
dokumentärfilm (noun)	I en dokumentärfilm beskriver man verkliga händelser och människor. 
kritisera (verb)	Ett barn som kritiseras lär sig att fördöma. 
specificering (noun)	Den där specificeringen av gränden gjorde saken sannolik. 
kroatisk (adjective)	Zlato = guld på bosniska, kroatiska och serbiska. 
specifik (adjective)	Många tror att deras chefer ska ha specifika egenskaper, beroende på om de är män eller kvinnor. 
dominant (adjective)	Ju fler syskon förstabarnet har, desto mer dominant och regelstyrd kan han eller hon bli. 
spektakel (noun)	Annars kommer jag hit i morgon igen, och det skulle bli ett snyggt spektakel. 
krok (noun)	Det händer alltjämt att en fiskare spottar på den maskade kroken, innan han kastar reven i vattnet. 
domkyrka (noun)	Det hände t ex i Lunds domkyrka där man kan se jätten Finn krama en av pelarna. 
krokig (adjective)	Gamla svullnader på några fingrar och en aning krokig tumme vittnar om att spelet är tufft. 
spekulation (noun)	Spekulationerna har varit många. 
krom (noun)	Golvet är schackrutigt, bord och stolar har blänkande krom och röda dynor. 
donera (verb)	Sin stora förmögenhet donerade han till en stiftelse. 
kronofogde (noun)	Tanken på att få hem kronofogden är en fasa för många. 
kronofogdemyndighet (noun)	Andra hatade eller rättare sagt fruktade yrkesgrupper är de som arbetar på kronofogdemyndigheten, s k kronoinspektörer. 
doping (noun)	Att sova är faktiskt bra doping. 
dopp (noun)	Viktiga inslag är sill i olika former, kokt skinka och ofta dopp i grytan. 
spelfilm (noun)	På biograferna visas mest spelfilmer, filmer som berättar en påhittad historia. 
dra av (vbm)	Han har redan dragit av rabatten. 
dra ihop (vbm)	Mitt hjärta drogs ihop som om mörkret kommit in och börjat krama på det. 
kroppsdel (noun)	I många idiomatiska uttryck förekommer namn på olika kroppsdelar. 
kroppslig (adjective)	Där anses det viktigt att uppnå harmoni mellan det andliga och kroppsliga. 
dra på sig (vbm)	Han hade sluppit kvida och jämra, som han alltid fått göra, då han dragit en sko på sig. 
dra sig (vbm)	Min far fick dra av sig den ena resårkängan och expediten mätte den med ett måttband. 
dra sig tillbaka (vbm)	Freja Vad var det som fick dig att dra dig tillbaka när allt gick så bra? 
spinna (verb)	Jag kurar ihop mig i soffhörnet som en katt och kunde jag spinna skulle jag göra det. 
